Information for device AUDIOPORTAL (VID=0x1430 PID=0x09AA):

------------------------------
Connection Information:
------------------------------
Device current bus speed: FullSpeed
Device supports USB 1.1 specification
Device supports USB 2.0 specification
Device address: 0x0006
Current configuration value: 0x01
Number of open pipes: 2


------------------------------
Device Descriptor:
------------------------------
0x12	bLength
0x01	bDescriptorType
0x0200	bcdUSB
0xFF	bDeviceClass      (Vendor specific)
0xFF	bDeviceSubClass   
0xFF	bDeviceProtocol   
0x40	bMaxPacketSize0   (64 bytes)
0x1430	idVendor
0x09AA	idProduct
0x0227	bcdDevice
0x01	iManufacturer   "Activision"
0x02	iProduct        "AUDIOPORTAL"
0x03	iSerialNumber   "0000A02C14149883"
0x01	bNumConfigurations


-------------------------
Configuration Descriptor:
-------------------------
0x09	bLength
0x02	bDescriptorType
0x0040	wTotalLength   (64 bytes)
0x02	bNumInterfaces
0x01	bConfigurationValue
0x00	iConfiguration
0x80	bmAttributes   (Bus-powered Device)
0xFA	bMaxPower      (500 mA)

Interface Descriptor:
------------------------------
0x09	bLength
0x04	bDescriptorType
0x00	bInterfaceNumber
0x00	bAlternateSetting
0x02	bNumEndPoints
0xFF	bInterfaceClass      (Vendor specific)
0x47	bInterfaceSubClass   
0xD0	bInterfaceProtocol   
0x00	iInterface

Endpoint Descriptor:
------------------------------
0x07	bLength
0x05	bDescriptorType
0x81	bEndpointAddress  (IN endpoint 1)
0x03	bmAttributes      (Transfer: Interrupt / Synch: None / Usage: Data)
0x0040	wMaxPacketSize    (1 x 64 bytes)
0x04	bInterval         (4 frames)

Endpoint Descriptor:
------------------------------
0x07	bLength
0x05	bDescriptorType
0x02	bEndpointAddress  (OUT endpoint 2)
0x03	bmAttributes      (Transfer: Interrupt / Synch: None / Usage: Data)
0x0040	wMaxPacketSize    (1 x 64 bytes)
0x04	bInterval         (4 frames)

Interface Descriptor:
------------------------------
0x09	bLength
0x04	bDescriptorType
0x01	bInterfaceNumber
0x00	bAlternateSetting
0x00	bNumEndPoints
0xFF	bInterfaceClass      (Vendor specific)
0x47	bInterfaceSubClass   
0xD0	bInterfaceProtocol   
0x00	iInterface

Interface Descriptor:
------------------------------
0x09	bLength
0x04	bDescriptorType
0x01	bInterfaceNumber
0x01	bAlternateSetting
0x02	bNumEndPoints
0xFF	bInterfaceClass      (Vendor specific)
0x47	bInterfaceSubClass   
0xD0	bInterfaceProtocol   
0x00	iInterface

Endpoint Descriptor:
------------------------------
0x07	bLength
0x05	bDescriptorType
0x03	bEndpointAddress  (OUT endpoint 3)
0x01	bmAttributes      (Transfer: Isochronous / Synch: None / Usage: Data)
0x0040	wMaxPacketSize    (1 x 64 bytes)
0x01	bInterval         (1 frames)

Endpoint Descriptor:
------------------------------
0x07	bLength
0x05	bDescriptorType
0x84	bEndpointAddress  (IN endpoint 4)
0x01	bmAttributes      (Transfer: Isochronous / Synch: None / Usage: Data)
0x0040	wMaxPacketSize    (1 x 64 bytes)
0x01	bInterval         (1 frames)

Microsoft OS Descriptor is not available. Error code: 0x0000001F


--------------------------------
String Descriptor Table
--------------------------------
Index  LANGID  String
0x00   0x0000  0x0409 
0x01   0x0409  "Activision"
0x02   0x0409  "AUDIOPORTAL"
0x03   0x0409  "0000A02C14149883"

------------------------------

Connection path for device: 
USB xHCI Compliant Host Controller
Root Hub
AUDIOPORTAL (VID=0x1430 PID=0x09AA) Port: 3

Running on: Windows 10 or greater (Build Version 19045)

Brought to you by TDD v2.17.0, Feb 23 2021, 14:04:02
